{
  "schema_version": "1.1",
  "report_id": "rpt_release_readiness_001",
  "report_type": "release_readiness",
  "status": "ready",
  "format": "json",
  "content": {
    "summary": {
      "project_id": "proj_customer_support_ai",
      "environment": "preprod",
      "ready": false
    },
    "blockers": [
      "Open approval request: appr_network_change_001"
    ]
  },
  "artifact_ref": null,
  "trace_id": "trc_rpt_001",
  "generated_at": "2026-02-21T10:30:00-06:00"
}
